answer,question
Clausius-Clapeyron relation,"The Clausius¨CClapeyron relation, named after Rudolf Clausius[1] and Beno?t Paul ?mile Clapeyron,[2] is a way of characterizing a discontinuous phase transition between two phases of matter of a single constituent. On a pressure¨Ctemperature (P¨CT) diagram, the line separating the two phases is known as the coexistence curve. The Clausius¨CClapeyron relation gives the slope of the tangents to this curve. Mathematically,where \mathrm{d}P/\mathrm{d}T is the slope of the tangent to the coexistence curve at any point, L is the specific latent heat, T is the temperature, \Delta v  is the specific volume change of the phase transition and \Delta s  is the specific entropy change of the phase transition"
Alkyne,"In organic chemistry, an alkyne is an unsaturated hydrocarbon containing at least one carbon¥ªcarbon triple bond between two carbon atoms.[1] The simplest acyclic alkynes with only one triple bond and no other functional groups form a homologous series with the general chemical formula CnH2n-2. Alkynes are traditionally known as acetylenes, although the name acetylene also refers specifically to C2H2, known formally as ethyne using IUPAC nomenclature. Like other hydrocarbons, alkynes are generally hydrophobic but tend to be more reactive."
Stern-Gerlach experiment,"The Stern¨CGerlach experiment showed that the spatial orientation of angular momentum is quantized. It demonstrated that atomic-scale systems have intrinsically quantum properties, and that measurement in quantum mechanics affects the system being measured. In the original experiment, silver atoms were sent through a non-uniform magnetic field, which deflected them before they struck a detector screen. Other kinds of particles can be used. If the particles have a magnetic moment related to their spin angular momentum, the magnetic field gradient deflects them from a straight path. The screen reveals discrete points of accumulation rather than a continuous distribution, owing to the quantum nature of spin. Historically, this experiment was decisive in convincing physicists of the reality of angular momentum quantization in all atomic-scale systems."
Neutron,"The neutron is a subatomic particle, symbol n or n0, with no net electric charge and a mass slightly larger than that of a proton. Protons and neutrons, each with mass approximately one atomic mass unit, constitute the nucleus of an atom, and they are collectively referred to as nucleons.[4] Their properties and interactions are described by nuclear physics.The nucleus consists of Z protons, where Z is called the atomic number, and N neutrons, where N is the neutron number. The atomic number defines the chemical properties of the atom, and the neutron number determines the isotope or nuclide.[5] The terms isotope and nuclide are often used synonymously, but they refer to chemical and nuclear properties, respectively. The atomic mass number, symbol A, equals Z+N. For example, carbon has atomic number 6, and its abundant carbon-12 isotope has 6 neutrons, whereas its rare carbon-13 isotope has 7 neutrons. Some elements occur in nature with only one stable isotope, such as fluorine (see stable nuclide). Other elements occur as many stable isotopes, such as tin with ten stable isotopes. Even though it is not a chemical element, the neutron is included in the table of nuclides.[6]Within the nucleus, protons and neutrons are bound together through the nuclear force, and neutrons are required for the stability of nuclei. Neutrons are produced copiously in nuclear fission and fusion. They are a primary contributor to the nucleosynthesis of chemical elements within stars through fission, fusion, and neutron capture processes.The neutron is essential to the production of nuclear power. In the decade after the neutron was discovered in 1932,[7] neutrons were used to effect many different types of nuclear transmutations. With the discovery of nuclear fission in 1938,[8] it was quickly realized that, if a fission event produced neutrons, each of these neutrons might cause further fission events, etc., in a cascade known as a nuclear chain reaction.[5] These events and findings led to the first self-sustaining nuclear reactor (Chicago Pile-1, 1942) and the first nuclear weapon (Trinity, 1945).Free neutrons, or individual neutrons free of the nucleus, are effectively a form of ionizing radiation, and as such, are a biological hazard, depending upon dose.[5] A small natural ""neutron background"" flux of free neutrons exists on Earth, caused by cosmic ray muons, and by the natural radioactivity of spontaneously fissionable elements in the Earth's crust.[9] Dedicated neutron sources like neutron generators, research reactors and spallation sources produce free neutrons for use in irradiation and in neutron scattering experiments."
Leo (constellation),"Leo /?li?o?/ is one of the constellations of the zodiac, lying between Cancer to the west and Virgo to the east. Its name is Latin for lion, and to the ancient Greeks represented the Nemean Lion killed by the mythical Greek hero Heracles (known to the ancient Romans as Hercules) as one of his twelve labors. Its symbol is Leo.svg ( ?). One of the 48 constellations described by the 2nd century astronomer Ptolemy, Leo remains one of the 88 modern constellations today, and one of the most easily recognizable due to its many bright stars and a distinctive shape that is reminiscent of the crouching lion it depicts. The lion's mane and shoulders also form an asterism known as ""the Sickle,"" which to modern observers may resemble a backwards ""question mark."""
Black hole,"A black hole is a geometrically defined region of spacetime exhibiting such strong gravitational effects that nothing¥ªincluding particles and electromagnetic radiation such as light¥ªcan escape from inside it.[1] The theory of general relativity predicts that a sufficiently compact mass can deform spacetime to form a black hole.[2][3] The boundary of the region from which no escape is possible is called the event horizon. Although crossing the event horizon has enormous effect on the fate of the object crossing it, it appears to have no locally detectable features. In many ways a black hole acts like an ideal black body, as it reflects no light.[4][5] Moreover, quantum field theory in curved spacetime predicts that event horizons emit Hawking radiation, with the same spectrum as a black body of a temperature inversely proportional to its mass. This temperature is on the order of billionths of a kelvin for black holes of stellar mass, making it essentially impossible to observe."
Angular momentum,"In physics, angular momentum (rarely, moment of momentum or rotational momentum) is the rotational analog of linear momentum. It is an important quantity in physics because it is a conserved quantity ¨C the angular momentum of a system rema"
Neptune,"Neptune is the eighth and farthest planet from the Sun in the Solar System. It is the fourth-largest planet by diameter and the third-largest by mass. Among the giant planets in the Solar System, Neptune is the most dense. Neptune is 17 times the mass of Earth and is slightly more massive than its near-twin Uranus, which is 15 times the mass of Earth and slightly larger than Neptune.[c] Neptune orbits the Sun at an average distance of 30.1 astronomical units (4.50¥Á109 km). Named after the Roman god of the sea, its astronomical symbol is ?, a stylised version of the god Neptune's trident.Neptune is not visible to the unaided eye and is the only planet found by mathematical prediction rather than by empirical observation. Unexpected changes in the orbit of Uranus led Alexis Bouvard to deduce that its orbit was subject to gravitational perturbation by an unknown planet. Neptune was subsequently observed with a telescope on 23 September 1846[1] by Johann Galle within a degree of the position predicted by Urbain Le Verrier. Its largest moon, Triton, was discovered shortly thereafter, though none of the planet's remaining 14 moons were located telescopically until the 20th century. The planet's distance from Earth gives it a very small apparent size, making it challenging to study with Earth-based teles""pes. Neptune was visited by Voyager 2, when it flew by the planet on 25 August 1989.[10] The advent of Hubble Space Telescope and large ground-based telescopes with adaptive optics has allowed for more-detailed observations.Neptune is similar in composition to Uranus, and both have compositions that differ from those of the larger gas giants, Jupiter and Saturn. Neptune's atmosphere, like Jupiter's and Saturn's, is composed primarily of hydrogen and helium, along with traces of hydrocarbons and possibly nitrogen; it contains a higher proportion of ""ices"" such as water, ammonia, and methane. Scientists sometimes categorise Uranus and Neptune as ""ice giants"" to emphasise this distinction.[11] The interior of Neptune, like that of Uranus, is primarily composed of ices and rock.[12] Traces of methane in the outermost regions in part account for the planet's blue appearance.[13]In contrast to the hazy, relatively featureless atmosphere of Uranus, Neptune's atmosphere has active and visible weather patterns. For example, at the time of the 1989 Voyager 2 flyby, the planet's southern hemisphere had a Great Dark Spot comparable to the Great Red Spot on Jupiter. These weather patterns are driven by the strongest sustained winds of any pl"
Star,"A star is a luminous sphere of plasma held together by its own gravity. The nearest star to Earth is the Sun. Other stars are visible from Earth during the night, appearing as a multitude of fixed luminous points in the sky due to their immense distance from Earth. Historically, the most prominent stars were grouped into constellations and asterisms, and the brightest stars gained proper names. Extensive catalogues of stars have been assembled by astronomers, which provide standardized star designations."
Pulsar,"A pulsar (short for pulsating radio star)[1] is a highly magnetized, rotating neutron star that emits a beam of electromagnetic radiation. This radiation can be observed only when the beam of emission is pointing toward Earth, much the way a lighthouse can be seen only when the light is pointed in the direction of an observer, and is responsible for the pulsed appearance of emission. Neutron stars are very dense, and have short, regular rotational periods. This produces a very precise interval between pulses that range roughly from milliseconds to seconds for an individual pulsar. Pulsars are believed to be one of the candidates of high and ultra-high energy astroparticles (see also Centrifugal mechanism of acceleration)."
Huitzilopochtli,"In the Aztec religion, Huitzilopochtli (Classical Nahuatl: Hu¨Štzil¨­p¨­chtli [wi:t?silo??po?t??t??i]), is a Mesoamerican deity of war, sun, human sacrifice and the patron of the city of Tenochtitlan. He was also the national god of the Mexicas, also known as Aztecs, of Tenochtitlan. Many in the pantheon of deities of the Aztecs were inclined to have a fondness for a particular aspect of warfare. However, Huitzilopochtli was known as the primary god of war in ancient Mexico. Since he was the patron god of the Mexica, he was credited with both the victories and defeats that the Mexica people had on the battlefield.[1] It is important to remember that the defeat of their patron deity meant the defeat of his people. This is one of the many reasons why they were concerned with providing exquisite tribute and food for him. Not only was it important for him to survive his battles, but the fate of the Mexica people would have rested in the victory of Huitzilopochtli."
Zeeman effect,"The Zeeman effect (/?ze?m?n/; Dutch pronunciation: [?ze?m¨n]), named after the Dutch physicist Pieter Zeeman, is the effect of splitting a spectral line into several co"
Neutron star,"A neutron star is a type of compact star that can result from the gravitational collapse of a massive star after a supernova. Neutron stars are the densest and smallest stars known to exist in the Universe; with a radius of only about 1111.5 km (7 mi),[citation needed] they can have a mass of about twice that of the Sun.Neutron stars are composed almost entirely of neutrons, which are subatomic particles without net electrical charge and with slightly larger mass than protons. Neutron stars are very hot and are supported against further collapse by quantum degeneracy pressure due to the phenomenon described by the Pauli exclusion principle, which states that no two neutrons (or any other fermionic particles) can occupy the same place and quantum state simultaneously.In general, compact stars of less than 1.39 M	 (the Chandrasekhar limit) are white dwarfs, whereas compact stars with a mass between 1.4 M	 and 3 M	 (the TolmanOppenheimerVolkoff limit) should be neutron stars. The maximum observed mass of neutron stars is about 2 M	. Compact stars with more than 10 M	 will overcome the neutron degeneracy pressure and gravitational collapse will usually occur to produce a black hole, though the smallest observed mass of a stellar black hole is about 5 M¨?.[9] Between 3 M¨? and 5 M¨?, hypothetical intermediate-mass stars such as quark stars and electroweak stars have been proposed, but none have been shown to exist. The equations of state of matter at such high densities are not precisely known because of the theoretical and empirical difficulties (see quantum gravity).Some neutron stars rotate very rapidly (up to 716 times a sec"
Quasar,"Quasars (/?kwe?z¨r/) or quasi-stellar radio sources are the most energetic and distant members of a class of objects called active galactic nuclei (AGN). Quasars are extremely luminous and were first identified as being high redshift sources of electromagnetic energy, including radio waves and visible light, that appeared to be similar to stars, rather than extended sources similar to galaxies. Their spectra contain very broad emission lines, unlike any known from stars, hence the name ""uasi-stellar."" Their luminosity can be 100 times greater than that of the Milky Way.[2] Most quasars were formed approximately 12 billion years ago, and they are normally caused by collisions of galaxies, with the galaxies' central black holes merging to form either a supermassive black hole[3] or a binary black hole system.Although the true nature of these objects was controversial until the early 1980s, there is now a scientific consensus that a quasar is a compact region in the center of a massive galaxy surrounding a central supermassive black hole.[4] Its size is 10¨C10,000 times the Schwarzschild radius of the enclosed black hole. The energy emitted by a quasar derives from mass falling onto the accretion disc around the black hole.."
Ganymede (moon),"Ganymede /ÈaænhmiÐd/[12] (Jupiter III) is the largest moon of Jupiter and in the Solar System, and the only moon known to have a magnetosphere. It is the seventh satellite outward from Jupiter[13] and third of the Galilean moons, the first group of objects discovered orbiting another planet. Completing an orbit in roughly seven days, Ganymede participates in a 1:2:4 orbital resonance with the moons Europa and Io, respectively. With a diameter of 5,268 km (3,273 mi), it is 8% larger than the planet Mercury, but has only 45% as much mass.[14] Its diameter is 2% larger than that of Saturn's Titan, the Solar System's second-largest moon. At 2.02 times the mass of the Moon, it is the most massive planetary satellite.[15] It is the 9th largest object in the Solar System, and the largest without a substantial atmosphere.Ganymede is composed of approximately equal amounts of silicate rock and water ice.[16] It is a fully differentiated body with an iron-rich, liquid core, and an internal ocean that may contain more water than all of Earth's oceans together.[17][18][19][20][21] Its surface is composed of two main types of terrain. Dark regions, saturated with impact craters and dated to four billion years ago, cover about a third of the satellite. Lighter regions, crosscut by extensive grooves and ridges and only slightly less ancient, cover the remainder. The cause of the light terrain's disrupted geology is not fully known, but was likely the result of tectonic activity brought about by tidal heating.[5]Ganymede's magnetosphere was probably created through convection within its liquid iron core.[22] The meager magnetosphere is buried within Jupiter's much larger magnetic field an"
Kuiper belt,"The Kuiper belt /?ka?p?r/ or /'k?yp?r/[1] (as in Dutch), sometimes called the Edgeworth¨CKuiper belt, is a circumstellar disc in the Solar System beyond the planets, extending from the orbit of Neptune (at 30 AU) to approximately 50 AU from the Sun.[2] It is similar to the asteroid belt, but it is far larger¥ª20 times as wide and 20 to 200 times as massive.[3][4] Like the asteroid belt, it consists mainly of small bodies, or remnants from the Solar System's formation. Although many asteroids are composed primarily of rock and metal, most Kuiper belt objects are composed largely of frozen volatiles (termed ""es""), such as methane, ammonia and water. The Kuiper belt is home to three officially recognized dwarf planets: Pluto, Haumea, and Makemake. Some of the Solar System's moons, such as Neptune's Triton and Saturn's Phoebe, are also thought to have originated in the region.The Kuiper belt was named after Dutch-American astronomer Gerard Kuiper, though he did not actually predict its existence. In 1992, 1992 QB1 was discovered, the first Kuiper belt object (KBO) since Pluto.[7] Since its discovery, the number of known KBOs has increased to over a thousand, and more than 100,000 KBOs over 100 km (62 mi) in diameter are thought to exist.[8] The Kuiper belt was initially thought to be the main repository for periodic comets, those with orbits lasting less than 200 years. However, studies since the mid-1990s have shown that the belt is dynamically stable, and that comets' true place of origin is the scattered disc, a dynamically active zone created by the outward motion of Neptune 4.5 billion years ago;[9] scattered disc objects such as Eris have extremely eccentric orbits that take them as far as 100 AU from the Sun.The Kuiper belt should not be confused with the theorized Oort cloud, which is a thousand times more distant and is not flat. The objects within the Kuiper belt, together with the members of the scattered disc and any potential Hills cloud or Oort cloud objects, are collectively referred to as trans-Neptunian objects (TNOs).Pluto is likely the largest and most-massive member of the Kuiper belt and the largest and the second-most-massive known TNO, surpassed only by Eris in the scattered disc.[nb 1] Originally considered a planet, Pluto's status as part of the Kuiper belt caused it to be reclassified as a dwarf planet in 2006. It is compositionally similar to many other objects of the Kuiper belt, and its orbital period is characteristic of a class of KBOs, known as ""plutinos"", that share the same 2:3 resonance with Neptune..r"
Solar wind,"The solar wind is a stream of charged particles released from the upper atmosphere of the Sun. This plasma consists of mostly electrons, protons and alpha particles with energies usually between 1.5 and 10 keV; embedded in the solar-wind plasma is the interplanetary magnetic field. The solar wind varies in density, temperature and speed over time and over solar longitude. Its particles can escape the Sun's gravity because of their high energy, from the high temperature of the corona and magnetic, electrical and electromagnetic phenomena in it.The solar winds flow outward supersonically at varying speeds depending on their origin reaching up to around one million miles per hour[1] to great distances, filling a region known as the heliosphere, an enormous bubble-like volume surrounded by the interstellar medium. Other related phenomena include the aurora (northern and southern lights), the plasma tails of comets that always point away from the Sun, and geomagnetic storms that can change the direction of magnetic field lines and create strong currents in power grids on Earth."
Keratin,"Keratin (/?k?r?t?n/[1][2]) is a family of fibrous structural proteins. Keratin is the protein that protects epithelial cells from damage or stress that has potential to kill the cell. It is the key structural material making up the outer layer of human skin. It is the key structural component of hair and nails, and it provides the necessary strength and toughness for masticatory organs, such as the tongue and the hard palate. Keratin monomers assemble into bundles to form intermediate filaments, which are tough and form strong unmineralized tissues found in reptiles, birds, amphibians, and mammals. The only other biological matter known to approximate the toughness of keratinized tissue is chitin.[3][4][5]"
Transfer RNA,"A transfer RNA (abbreviated tRNA and archaically referred to as sRNA, for soluble RNA[1]) is an adaptor molecule composed of RNA, typically 76 to 90 nucleotides in length,[2] that serves as the physical link between the mRNA and the amino acid sequence of proteins. It does this by carrying an amino acid to the protein synthetic machinery of a cell (ribosome) as directed by a three-nucleotide sequence (codon) in a messenger RNA (mRNA). As such, tRNAs are a necessary component of translation, the biological synthesis of new proteins according to the genetic code.The specific nucleotide sequence of an mRNA specifies which amino acids are incorporated into the protein product of the gene from which the mRNA is transcribed, and the role of tRNA is to specify which sequence from the genetic code corresponds to which amino acid.[3] One end of the tRNA matches the genetic code in a three-nucleotide sequence called the anticodon. The anticodon forms three base pairs with a codon in mRNA during protein biosynthesis. The mRNA encodes a protein as a series of contiguous codons, each of which is recognized by a particular tRNA. On the other end of the tRNA is a covalent attachment to the amino acid that corresponds to the anticodon sequence. Each type of tRNA molecule can be attached to only one type of amino acid, so each organism has many types of tRNA (in fact, because the genetic code contains multiple codons that specify the same amino acid, there are several tRNA molecules bearing different anticodons which also carry the same amino acid).The covalent attachment to the tRNA 3¥¯ end is catalyzed by enzymes called aminoacyl tRNA synthetases. During pro"
Operon,"In genetics, an operon is a functioning unit of genomic DNA containing a cluster of genes under the control of a single promoter.[1] The genes are transcribed together into an mRNA strand and either translated together in the cytoplasm, or undergo trans-splicing to create monocistronic mRNAs that are translated separately, i.e. several strands of mRNA that each encode a single gene product. The result of this is that the genes contained in the operon are either expressed together or not at all. Several genes must be co-transcribed to define an operon.[2]Originally, operons were thought to exist solely in prokaryotes, but since the discovery of the first operons in eukaryotes in the early 1990s,[3][4] more evidence has arisen to suggest they are more common than previously assumed.[5] In general, expression of prokaryotic operons leads to the generation of polycistronic mRNAs, while eukaryotic operons lead to monocistronic mRNAs.Operons are also found in viruses such as bacteriophages.[6][7] For example, T7 phages have two operons. The first operon codes for various products, including a special T7 RNA polymerase which can bind to and transcribe the second operon. The second operon includes a lysis gene meant to cause the host cell to burst.[8]"
