answer,question
Group (mathematics),"In mathematics, a group is an algebraic structure consisting of a set of elements together with an operation that combines any two elements to form a third element. The operation satisfies four conditions called the group axioms, namely closure, associativity, identity and invertibility. One of the most familiar examples of a group is the set of integers together with the addition operation, but the abstract formalization of the group axioms, detached as it is from the concrete nature of any particular group and its operation, applies much more widely. It allows entities with highly diverse mathematical origins in abstract algebra and beyond to be handled in a flexible way while retaining their essential structural aspects. The ubiquity of groups in numerous areas within and outside mathematics makes them a central organizing principle of contemporary mathematics"
Equilibrium constant,"The equilibrium constant of a chemical reaction is the value of the reaction quotient when the reaction has reached equilibrium. An equilibrium constant value is independent of the analytical concentrations of the reactant and product species in a mixture, but depends on temperature and on ionic strength. Known equilibrium constant values can be used to determine the composition of a system at equilibrium."
Pauli exclusion principle,"The Pauli exclusion principle is the quantum mechanical principle that states that two identical fermions (particles with half-integer spin) cannot occupy the same quantum state simultaneously. In the case of electrons, it can be stated as follows: it is impossible for two electrons of a poly-electron atom to have the same values of the four quantum numbers: n, the principal quantum number, ? , the angular momentum quantum number, m?, the magnetic quantum number, and ms, the spin quantum number. For two electrons residing in the same orbital, n, ?, and m? are the same, so ms, the spin, must be different, and thus the electrons have opposite half-integer spins, 1/2 and -1/2. This principle was formulated by Austrian physicist Wolfgang Pauli in 1925."
Raman scattering,"is the inelastic scattering of a photon. It was discovered by C. V. Raman and K. S. Krishnan in liquids,[1] and by G. Landsberg and L. I. Mandelstam in crystals.[2] The effect had been predicted theoretically by Adolf Smekal in 1923 When photons are scattered from an atom or molecule, most photons are elastically scattered (Rayleigh scattering), such that the scattered photons have the same energy (frequency and wavelength) as the incident photons. A small fraction of the scattered photons (approximately 1 in 10 million) are scattered by an excitation, with the scattered photons having a frequency different from, and usually lower than, that of the incident photons.[4] In a gas, Raman scattering can occur with a change in energy of a molecule due to a transition to another (usually higher) energy level. Chemists are primarily concerned with the transitional Raman effect."
Red blood cell,"Red blood cells (RBCs), also called erythrocytes, are the most common type of blood cell and the vertebrate organism's principal means of delivering oxygen (O2) to the body tissues¥ªvia blood flow through the circulatory system.[1] RBCs take up oxygen in the lungs or gills and release it into tissues while squeezing through the body's capillaries.The cytoplasm of erythrocytes is rich in hemoglobin, an iron-containing biomolecule that can bind oxygen and is responsible for the red color of the cells. The cell membrane is composed of proteins and lipids, and this structure provides properties essential for physiological cell function such as deformability and stability while traversing the circulatory system and specifically the capillary network.Red blood cells are also known as RBCs, red cells,[5] red blood corpuscles (an archaic term), haematids, erythroid cells or erythrocytes (from Greek erythros for ""ed"" and kytos for ""hollow vessel"", with -cyte translated as ""cell"" in modern usage). Packed red blood cells (pRBC) are red blood cells that have been donated, processed, and stored in a blood bank for blood transfusion.c"
Temperature,"A temperature is an objective comparative measure of hot or cold. It is measured by a thermometer, which may work through the bulk behavior of a thermometric material, detection of thermal radiation, or particle kinetic energy. Several scales and units exist for measuring temperature, the most common being Celsius (denoted ¥ãC; formerly called centigrade), Fahrenheit (denoted ¥ãF), and, especi"
Titanium,"Titanium is a chemical element with symbol Ti and atomic number 22. It is a lustrous transition metal with a silver color, low density and high strength. It is highly resistant to corrosion in sea water, aqua regia and chlorine.Titanium was discovered in Cornwall, Great Britain, by William Gregor in 1791 and named by Martin Heinrich Klaproth for the Titans of Greek mythology. The element occurs within a number of mineral deposits, principally rutile and ilmenite, which are widely distributed in the Earth's crust and lithosphere, and it is found in almost all living things, rocks, water bodies, and soils.[3] The metal is extracted from its principal mineral ores via the Kroll process[4] or the Hunter process. Its most common compound, titanium dioxide, is a popular photocatalyst and is used in the manufacture of white pigments.[5] Other compounds include titanium tetrachloride (TiCl4), a component of smoke screens and catalysts; and titanium trichloride (TiCl3), which is used as a catalyst in the production of polypropylene.Titanium can be alloyed with iron, aluminium, vanadium, and molybdenum, among other elements, to produce strong, lightweight alloys for aerospace (jet engines, missiles, and spacecraft), military, industrial process (chemicals and petro-chemicals, desalination plants, pulp, and paper), automotive, agri-food, medical prostheses, orthopedic implants, dental and endodontic instruments and files, dental implants, sporting goods, jewelry, mobile phones, and other applications"
Zinc,"Zinc, in commerce also spelter, is a chemical element with symbol Zn and atomic number 30. It is the first element of group 12 of the periodic table. In some respects zinc is chemically similar to magnesium: its ion is of similar size and its only common oxidation state is +2. Zinc is the 24th most abundant element in Earth's crust and has five stable isotopes. The most common zinc ore is sphalerite (zinc blende), a zinc sulfide mineral. The largest mineable amounts are found in Australia, Asia, and the United States. Zinc production includes froth flotation of the ore, roasting, and final extraction using electricity (electrowinning).Brass, which is an alloy of copper and zinc, has been used since at least the 10th century BC in Judea[2] and by the 7th century BC in Ancient Greece.[3] Zinc metal was not produced on a large scale until the 12th century in India and was unknown to Europe until the end of the 16th century. The mines of Rajasthan have given definite evidence of zinc production going back to the 6th century BC.[4] To date, the oldest evidence of pure zinc comes from Zawar, in Rajasthan, as early as the 9th century AD when a distillation process was employed to make pure zinc.[5] Alchemists burned zinc in air to form what they called ""philosopher's wool"" or ""white snow"".The element was probably named by the alchemist Paracelsus after the German word Zinke. German chemist Andreas Sigismund Marggraf is credited with discovering pure metallic zinc in 1746. Work by Luigi Galvani and Alessandro Volta uncovered the electrochemical properties of zinc by 1800. Corrosion-resistant zinc plating of iron (hot-dip galvanizing) is the major application for zinc. Other applications are in batteries, small non-structural castings, and alloys, such as brass. A variety of zinc compounds are commonly used, such as zinc carbonate and zinc gluconate (as dietary supplements), zinc chloride (in deodorants), zinc pyrithione (anti-dandruff shampoos), zinc sulfide (in luminescent paints), and zinc methyl or zinc diethyl in the organic laboratory.Zinc is an essential mineral perceived by the public today as being of ""exceptional biologic and public health importance"", especially regarding prenatal and postnatal development.[6] Zinc deficiency affects about two billion people in the developing world and is associated with many diseases.[7] In children it causes growth retardation, delayed sexual maturation, infection susceptibility, and diarrhea.[6] Enzymes with a zinc atom in the reactive center are widespread in biochemistry, such as alcohol dehydrogenase in humans.[8] Consumption of excess zinc can cause ataxia, lethargy and copper deficiency."
Davisson-Germer experiment,"The Davisson¨CGermer experiment was a physics experiment conducted by American physicists Clinton Davisson and Lester Germer in the years 1923 ¨C 1927,[1] which confirmed the de Broglie hypothesis. This hypothesis advanced by Louis de Broglie in 1924 says that particles of matter such as electrons have wave-like properties. The experiment not only played a major role in verifying the de Broglie hypothesis and demonstrated the wave-particle duality, but also was an important historical development in the establishment of quantum mechanics and of the Schr?dinger equation."
Solubility,"Solubility is the property of a solid, liquid, or gaseous chemical substance called solute to dissolve in a solid, liquid, or gaseous solvent to form a solution of the solute in the solvent. The solubility of a substance fundamentally depends on the physical and chemical properties of the solute and solvent as well as on temperature, pressure and the pH of the solution. The extent of the solubility of a substance in a specific solvent is measured as the saturation concentration, where adding more solute does not increase the concentration of the solution and begins to precipitate the excess amount of solute. The solubility of a substance is an entirely different property from the rate of solution, which is how fast it dissolves"
Antibody,"An antibody (Ab), also known as an immunoglobulin (Ig), is a large, Y-shape protein produced by plasma cells that is used by the immune system to identify and neutralize pathogens such as bacteria and viruses. The antibody recognizes a unique molecule of the harmful agent, called an antigen, via the variable region.[1][2] Each tip of the ""Y"" of an antibody contains a paratope (analogous to a lock) that is specific for one particular epitope (similarly analogous to a key) on an antigen, allowing these two structures to bind together with precision. Using this binding mechanism, an antibody can tag a microbe or an infected cell for attack by other parts of the immune system, or can neutralize its target directly (for example, by blocking a part of a microbe that is essential for its invasion and survival). The ability of an antibody to communicate with the other components of the immune system is mediated via its Fc region (located at the base of the ""Y""), which contains a conserved glycosylation site involved in these interactions.[3] The production of antibodies is the main function of the humoral immune system"
Arrows impossibility theorem,"In social choice theory, Arrow¥¯s impossibility theorem, the General Possibility Theorem or Arrow¥¯s paradox states that, when voters have three or more distinct alternatives (options), no rank order voting system can convert the ranked preferences of individuals into a community-wide (complete and transitive) ranking while also meeting a pre-specified set of criteria. These pre-specified criteria are called unrestricted domain, non-dictatorship, Pareto efficiency, and independence of irrelevant alternatives. The theorem is often cited in discussions of election theory as it is further interpreted by the Gibbard¨CSatterthwaite theorem."
Magnetic monopole,"A magnetic monopole is a hypothetical elementary particle in particle physics that is an isolated magnet with only one magnetic pole (a north pole without a south pole or vice versa).[1][2] In more technical terms, a magnetic monopole would have a net ""magnetic charge"". Modern interest in the concept stems from particle theories, notably the grand unified and superstring theories, which predict their existence"
Ketone,"In chemistry, a ketone (alkanone) /?ki?to?n/ is an organic compound with the structure RC(=O)R', where R and R' can be a variety of carbon-containing substituents. Ketones and aldehydes are simple compounds that contain a carbonyl group (a carbon-oxygen double bond). They are considered ""simple"" because they do not have reactive groups like ?OH or ?Cl attached directly to the carbon atom in the carbonyl group, as in carboxylic acids containing ?COOH.[1] Many ketones are known and many are of great importance in industry and in biology. Examples include many sugars (ketoses) and the industrial solvent acetone."
Second law of thermodynamics,"The second law of thermodynamics states that in every real process the sum of the entropies of all participating bodies is increased. In the idealized limiting case of a reversible process, this sum remains unchanged. The increase in entropy accounts for the irreversibility of natural processes, and the asymmetry between future and past.While often applied to more general processes, the law technically pertains to an event in which bodies initially in thermodynamic equilibrium are put into contact and allowed to come to a new equilibrium. This equilibration process involves the spread, dispersal, or dissipation[1] of matter or energy and results in an increase of entropy.The second law is an empirical finding that has been accepted as an axiom of thermodynamic theory. Statistical thermodynamics, classical or quantum, explains the microscopic origin of the law.The second law has been expressed in many ways. Its first formulation is credited to the French scientist Sadi Carnot in 1824 (see Timeline of thermodynamics)."
Cholesterol,"Cholesterol, from the Ancient Greek chole- (bile) and stereos (solid) followed by the chemical suffix -ol for an alcohol, is an organic molecule. It is a sterol (or modified steroid),[4] a lipid molecule and is biosynthesized by all animal cells because it is an essential structural component of all animal (not plant or bacterial) cell membranes that is required to maintain both membrane structural integrity and fluidity. Cholesterol enables animal cells to not need a cell wall (like plants and bacteria) to protect membrane integrity and cell viability, thus are able to change shape and move about (unlike bacteria and plant cells which are restricted by their cell walls)."
Vapor pressure,"Vapor pressure or equilibrium vapor pressure is defined as the pressure exerted by a vapor in thermodynamic equilibrium with its condensed phases (solid or liquid) at a given temperature in a closed system. The equilibrium vapor pressure is an indication of a liquid's evaporation rate. It relates to the tendency of particles to escape from the liquid (or a solid). A substance with a high vapor pressure at normal temperatures is often referred to as volatile. The pressure exhibited by vapor present above a liquid surface is known as vapor pressure. As the temperature of a liquid increases, the kinetic energy of its molecules also increases. As the kinetic energy of the molecules increases, the number of molecules transitioning into a vapor also increases, thereby increasing the vapor pressure.The vapor pressure of any substance increases non-linearly with temperature according to the Clausius¨CClapeyron relation. The atmospheric pressure boiling point of a liquid (also known as the normal boiling point) is the temperature at which the vapor pressure equals the ambient atmospheric pressure. With any incremental increase in that temperature, the vapor pressure becomes sufficient to overcome atmospheric pressure and lift the liquid to form vapor bubbles inside the bulk of the substance. Bubble formation deeper in the liquid requires a higher pressure, and t"
Henrys law,"In chemistry, Henry's law is one of the gas laws formulated by the English chemist William Henry, who studied the topic in the early 19th century. In his publication about the quantity of gases absorbed by water,[1] he described the results of his experiments: water takes up, of gas condensed by one, two, or more additional atmospheres, a quantity which, ordinarily compressed, would be equal to twice, thrice, &c. the volume absorbed under the common pressure of the atmosphere.In other words, the amount of dissolved gas is proportional to its partial pressure in the gas phase. The proportionality factor is called the Henry's law constant.An everyday example of Henry's law is given by a carbonated soft drink in a bottle. Before it is opened, the gas above the drink is almost pure carbon dioxide at a pressure higher than atmospheric pressure. The drink itself contains dissolved carbon dioxide. When the bottle is opened, this gas escapes, giving the characteristic hiss. Because the partial pressure of carbon dioxide above the liquid is now much lower, some of the dissolved carbon dioxide comes out of the solution as bubbles. If the drink is left in the open, the concentration of carbon dioxide in solution will come into equilibrium with the carbon dioxide in the air, and the drink will go ""flat"". Another example is the depth-dependent dissolution of oxygen and nitrogen in the blood of underwater divers (decompression and decompression sickness)."
Dirac delta function,"In mathematics, the Dirac delta function, or ŒÄ function, is a generalized function, or distribution, on the real number line that is zero everywhere except at zero, with an integral of one over the entire real line.[1][2][3] The delta function is sometimes thought of as an infinitely high, infinitely thin spike at the origin, with total area one under the spike, and physically represents the density of an idealized point mass or point charge.[4] It was introduced by theoretical physicist Paul Dirac. In the context of signal processing it is often referred to as the unit impulse symbol (or function).[5] Its discrete analog is the Kronecker delta function, which is usually defined on a discrete domain and takes values 0 and 1."
Viscosity,"The viscosity of a fluid is a measure of its resistance to gradual deformation by shear stress or tensile stress.[1] For liquids, it corresponds to the informal concept of ""thickness"". For example, honey has a much higher viscosity than waterViscosity is a property arising from collisions between neighboring particles in a fluid that are moving at different velocities. When the fluid is forced through a tube, the particles which compose the fluid generally move more quickly near the tube's axis and more slowly near its walls: therefore some stress, (such as a pressure difference between the two ends of the tube), is needed to overcome the friction between particle layers to keep the fluid moving. For the same velocity pattern, the stress required is proportional to the fluid's viscosity.A fluid that has no resistance to shear stress is known as an ideal or inviscid fluid. Zero viscosity is observed only at very low temperatures in superfluids. Otherwise, all fluids have positive viscosity, and are technically said to be viscous or viscid. In common parlance however, a liquid is said to be viscous if its viscosity is substantially greater than that of water; and may be described as mobile if the viscosity is noticeably less than water. A fluid with a relatively high viscosity, for example, pitch, may appear to be a solid."
Fractional distillation,"Fractional distillation is the separation of a mixture into its component parts, or fractions, such as in separating chemical compounds by their boiling point by heating them to a temperature at which one or more fractions of the compound will vaporize. It is a special type of distillation. Generally the component parts boil at less than 25 ¥ãC from each other under a pressure of one atmosphere. If the difference in boiling points is greater than 25 ¥ãC, a simple distillation is used."
Cyclic adenosine monophosphate,"Cyclic adenosine monophosphate (cAMP, cyclic AMP, or 3',5'-cyclic adenosine monophosphate) is a second messenger important in many biological processes. cAMP is a derivative of adenosine triphosphate (ATP) and used for intracellular signal transduction in many different organisms, conveying the cAMP-dependent pathway."
Glycogen,"Glycogen is a multibranched polysaccharide of glucose that serves as a form of energy storage in animals[2] and fungi. The polysaccharide structure represents the main storage form of glucose in the body.In humans, glycogen is made and stored primarily in the cells of the liver and the muscles hydrated with three or four parts of water.[3] Glycogen functions as the secondary long-term energy storage, with the primary energy stores being fats held in adipose tissue. Muscle glycogen is converted into glucose by muscle cells, and liver glycogen converts to glucose for use throughout the body including the central nervous system.Glycogen is the analogue of starch, a glucose polymer that functions as energy storage in plants. It has a structure similar to amylopectin (a component of starch), but is more extensively branched and compact than starch. Glycogen is found in the form of granules in the cytosol/cytoplasm in many cell types, and plays an important role in the glucose cycle. Glycogen forms an energy reserve that can be quickly mobilized to meet a sudden need for glucose, but one that is less compact than the energy reserves of triglycerides (lipids)."
Aldehyde,"An aldehyde /??ld?ha?d/ or alkanal is an organic compound containing a formyl group. The formyl group is a functional group, with the structure R-CHO, consisting of a carbonyl center (a carbon double bonded to oxygen) bonded to hydrogen and an R group,[1] which is any generic alkyl or side chain. The group without R is called the aldehyde group or formyl group. Aldehydes differ from ketones in that the carbonyl is placed at the end of a carbon skeleton rather than between two carbon atoms. Aldehydes are common in organic chemistry. Many fragrances are aldehydes."
Niacin,"Niacin (also known as vitamin B3 or nicotinic acid) is an organic compound with the formula C6H5NO2 and, depending on the definition used, one of the 20 to 80 essential human nutrients. Pharmaceutical and supplemental niacin are primarily used to treat hypercholesterolemia (high cholesterol) and pellagra (niacin deficiency). Insufficient niacin in the diet can cause nausea, skin and mouth lesions, anemia, headaches, and tiredness. The lack of niacin may also be observed in pandemic deficiency disease, which is caused by a lack of five crucial vitamins (niacin, vitamin C, thiamin, vitamin D, and vitamin A) and is usually found in areas of widespread poverty and malnutrition. Niacin has not been found to be useful in decreasing the risk of cardiovascular disease in those already on a statin[3] but appears to be effective in those not taking a statin.[4]"
Gamma,is the third letter of the Greek alphabet. In the system of Greek numerals it has a value of 3. It was derived from the Phoenician letter Gimel gimel. Letters that arose from gamma include the Roman C and G and the Cyrillic letters §¤ and ?.[1]
Helmholtz free energy,"In thermodynamics, the Helmholtz free energy is a thermodynamic potential that measures the ¥°useful¥¹ work obtainable from a closed thermodynamic system at a constant temperature. The negative of the difference in the Helmholtz energy is equal to the maximum amount of work that the system can perform in a thermodynamic process in which temperature is held constant. If the volume is not held constant, part of this work will be performed as boundary work. The Helmholtz energy is commonly used for systems held at constant volume. Since in this case no work is performed on the environment, the drop in the Helmholtz energy is equal to the maximum amount of useful work that can be extracted from the system. For a system at constant temperature and volume, the Helmholtz energy is minimized at equilibrium."
Gibberellin,"Gibberellins (GAs) are plant hormones that regulate growth and influence various developmental processes, including stem elongation, germination, dormancy, flowering, sex expression, enzyme induction, and leaf and fruit senescence.Gibberellin was first recognized in 1926 by a Japanese scientist, Eiichi Kurosawa, studying bakanae, the ""foolish seedling"" disease in rice.[1][2] It was first isolated in 1935 by Teijiro Yabuta and Sumuki, from fungal strains (Gibberella fujikuroi) provided by Kurosawa.[1] Yabuta named the isolate as gibberellinInterest in gibberellins outside of Japan began after World War II. In the United States, the first research was undertaken by a unit at Camp Detrick in Maryland, via studying seedlings of the bean Vicia faba.[1] In the United Kingdom, work on isolating new types of gibberellin was undertaken at Imperial Chemical Industries.[1] Interest in gibberellins spread around the world as the potential for its use on various commercially important plants became more obvious. For example, research that started at the University of California, Davis in the mid-1960s led to its commercial use on Thompson seedless table grapes throughout California by 1962.[3] A known antagonist to gibberellin is paclobutrazol (PBZ), which in turn inhibits growth and induces early fruitset as well as seedset."
