answer,question
Hamiltonian (quantum mechanics),"In quantum mechanics, the Hamiltonian is the operator corresponding to the total energy of the system in most of the cases. It is usually denoted by H, also ? or ?. Its spectrum is the set of possible outcomes when one measures the total energy of a system. Because of its close relation to the time-evolution of a system, it is of fundamental importance in most formulations of quantum theory."
7 (number),"is the natural number following 6 and preceding 8.Seven, the fourth prime number, is not only a Mersenne prime (since 23 ? 1 = 7) but also a double Mersenne prime since the exponent, 3, is itself a Mersenne prime. It is also a Newman¨CShanks¨CWilliams prime, a Woodall prime, a factorial prime, a lucky prime, a happy number (happy prime), a safe prime (the only Mersenne safe prime), and the fourth Heegner number.Seven is the lowest natural number that cannot be represented as the sum of the squares of three integers. (See Lagrange's four-square theorem#Historical development.)Seven is the aliquot sum of one number, the cubic number 8 and is the base of the 7-aliquot tree."
Glycolysis,"Glycolysis (from glycose, an older term[1] for glucose + -lysis degradation) is the metabolic pathway that converts glucose C6H12O6, into pyruvate, CH3COCOO? + H+. The free energy released in this process is used to form the high-energy compounds ATP (adenosine triphosphate) and NADH (reduced nicotinamide adenine dinucleotide) Glycolysis is a determined sequence of ten enzyme-catalyzed reactions. The intermediates provide entry points to glycolysis. For example, most monosaccharides, such as fructose and galactose, can be converted to one of these intermediates. The intermediates may also be directly useful. For example, the intermediate dihydroxyacetone phosphate (DHAP) is a source of the glycerol that combines with fatty acids to form fat.Glycolysis is an oxygen independent metabolic pathway, meaning that it does not use molecular oxygen (i.e. atmospheric oxygen) for any of its reactions. However the products of glycolysis (pyruvate and NADH + H+) are sometimes disposed of using atmospheric oxygen.[4] When molecular oxygen is used in the disposal of the products of glycolysis the process is usually referred to as aerobic, whereas if the disposal uses no oxygen the process is said to be anaerobic.[5] Thus, glycolysis occurs, with variations, in nearly all organisms, both aerobic and anaerobic. The wide occurrence of glycolysis indicates that it is one of the most ancient metabolic pathways.[6] Indeed, the reactions that constitute glycolysis and its parallel pathway, the pentose phosphate pathway, occur metal-catalyzed under the oxygen-free conditions of the Archean oceans, also in the absence of enzymes.[7] Glycolysis could thus have originated from chemical constraints of the prebiotic world."
Georg Wilhelm Friedrich Hegel,"was a German philosopher of the late Enlightenment. He achieved wide renown in his day and, while primarily influential within the continental tradition of philosophy, has become increasingly influential in the analytic tradition as well.[3] Although he remains a divisive figure, his canonical stature within Western philosophy is universally recognized.Hegel's principal achievement is his development of a distinctive articulation of idealism sometimes termed ""absolute idealism,""[5] in which the dualisms of, for instance, mind and nature and subject and object are overcome. His philosophy of spirit conceptually integrates psychology, the state, history, art, religion, and philosophy. His account of the master¨Cslave dialectic has been highly influential, especially in 20th-century France.[6] Of special importance is his concept of spirit (Geist: sometimes also translated as ""ind"") as the historical manifestation of the logical concept and the ""sublation"" (Aufhebung: integration without elimination or reduction) of seemingly contradictory or opposing factors; examples include the apparent opposition between nature and freedom and between immanence and transcendence. Hegel has been seen in the 21st century as the originator of the thesis, antithesis, synthesis triad; however this originated with Johann Fichteu"
Silver,"Silver is a chemical element with symbol Ag and atomic number 47. A soft, white, lustrous transition metal, it possesses the highest electrical conductivity, thermal conductivity and reflectivity of any metal. The metal occurs naturally in its pure, free form (native silver), as an alloy with gold and other metals, and in minerals such as argentite and chlorargyrite. Most silver is produced as a byproduct of copper, gold, lead, and zinc refining."
Spin (physics),"In quantum mechanics and particle physics, spin is an intrinsic form of angular momentum carried by elementary particles, composite particles (hadrons), and atomic nuclei.Spin is one of two types of angular momentum in quantum mechanics, the other being orbital angular momentum. The orbital angular momentum operator is the quantum-mechanical counterpart to the classical notion of angular momentum: it arises when a particle executes a rotating or twisting trajectory (such as when an electron orbits a nucleus).[3][4] The existence of spin angular momentum is inferred from experiments, such as the Stern¨CGerlach experiment, in which particles are observed to possess angular momentum that cannot be accounted for by orbital angular momentum alone."
Gross domestic product,"Gross domestic product (GDP) is a monetary measure of the value of all final goods and services produced in period of time (quarterly or yearly). GDP estimates are commonly used to determine the economic performance and standard of living of a whole country or region, and to make international comparisons GDP is not a complete measure of economic activity. It accounts for final output or value added at each stage of production, but not total output or total sales along the entire production process. It deliberately leaves out business-to-business (B2B) transactions in the early and intermediate stages of production, as well as sales of used goods. In the United States, the Bureau of Economic Analysis (BEA) has introduced a new quarterly statistic called gross output (GO), a broader measure that attempts to add up total sales or revenues at all stages of production.[2] Mark Skousen was the first economist to advocate GO as an important macroeconomic tool.[3] Other countries are following suit, such as the United Kingdom, which now producing an annual statistic called Total Output. GDP attempts to measure the ¥°use¥¹ economy, i.e., the value of finished goods and services ready to be used by consumers, business and government. GDP is similar to the ¥°bottom line¥¹ (earnings) of an accounting statement, which determined the ¥°value added¥¹ or the value of final use. GO is an estimate of the ¥°make¥¹ economy, i.e., the monetary value of sales at all stages of production. Thus, GO is similar to the ¥°top line¥¹ (revenues or sales) of an accounting statement. GDP and GO are not mutually exclusive, but complementary ways to examine what¥¯s happening in an economy."
Momentum,"In classical mechanics, linear momentum or translational momentum (pl. momenta; SI unit kg m/s, or equivalently, N s) is the product of the mass and velocity of an object. For example, a heavy truck moving rapidly has a large momentum¥ªit takes a large or prolonged force to get the truck up to this speed, and it takes a large or prolonged force to bring it to a stop afterwards. If the truck were lighter, or moving more slowly, then it would have less momentum."
Doppler effect,"The Doppler effect (or Doppler shift) is the change in frequency of a wave (or other periodic event) for an observer moving relative to its source. It is named after the Austrian physicist Christian Doppler, who proposed it in 1842 in Prague. It is commonly heard when a vehicle sounding a siren or horn approaches, passes, and recedes from an observer. Compared to the emitted frequency, the received frequency is higher during the approach, identical at the instant of passing by, and lower during the recession.When the source of the waves is moving toward the observer, each successive wave crest is emitted from a position closer to the observer than the previous wave. Therefore, each wave takes slightly less time to reach the observer than the previous wave. Hence, the time between the arrival of successive wave crests at the observer is reduced, causing an increase in the frequency. While they are travelling, the distance between successive wave fronts is reduced, so the waves ""bunch together"". Conversely, if the source of waves is moving away from the observer, each wave is emitted from a position farther from the observer than the previous wave, so the arrival time between successive waves is increased, reducing the frequency. The distance between successive wave fronts is then increased, so the waves ""spread out"".For waves that propagate in a medium, such as sound waves, the velocity of the observer and of the source are relative to the medium in which the waves are transmitted. The total Doppler effect may therefore result from motion of the source, motion of the observer, or motion of the medium. Each of these effects is analyzed separately. For waves which do not require a medium, such as light or gravity in general relativity, only the relative difference in velocity between the observer and the source needs to be considered."
Lattice energy,"The lattice energy of a crystalline solid is usually defined as the energy of formation of the crystal from infinitely-separated ions and as such is invariably negative. The concept of lattice energy was originally developed for rocksalt-structured and sphalerite-structured compounds like NaCl and ZnS, where the ions occupy high-symmetry crystal lattice sites. In the case of NaCl, the lattice energy is the energy released by the reaction Some older textbooks define lattice energy with the opposite sign,[2] i.e. the energy required to convert the crystal into infinitely separated gaseous ions in vacuum, an endothermic process. Following this convention, the lattice energy of NaCl would be +786 kJ/mol. The lattice energy for ionic crystals such as sodium chloride, metals such as iron, or covalently linked materials such as diamond is considerably greater in magnitude than for solids such as sugar or iodine, whose neutral molecules interact only by weaker dipole-dipole or van der Waals forces.The precise value of the lattice energy may not be determined experimentally, because of the impossibility of preparing an adequate amount of gaseous ions or atoms and measuring the energy released during their condensation to form the solid. However, the value of the lattice energy may either be derived theoretically from electrostatics or from a thermodynamic cycling reaction, the Born¨CHaber cycle."
Don Giovanni," is an opera in two acts with music by Wolfgang Amadeus Mozart and Italian libretto by Lorenzo Da Ponte. It is based on the legends of Don Juan, a fictional libertine and seducer. It was premiered by the Prague Italian opera at the Teatro di Praga (now called the Estates Theatre) on October 29, 1787.[1] Da Ponte's libretto was billed, like many of its time, as dramma giocoso, a term that denotes a mixing of serious and comic action. Mozart entered the work into his catalogue as an opera buffa. Although sometimes classified as comic, it blends comedy, melodrama and supernatural elements."
Diffraction,"Diffraction refers to various phenomena which occur when a wave encounters an obstacle or a slit. In classical physics, the diffraction phenomenon is described as the interference of waves according to the Huygens¨CFresnel principle. These characteristic behaviors are exhibited when a wave encounters an obstacle or a slit that is comparable in size to its wavelength. Similar effects occur when a light wave travels through a medium with a varying refractive index, or when a sound wave travels through a medium with varying acoustic impedance. Diffraction occurs with all waves, including sound waves, water waves, and electromagnetic waves such as visible light, X-rays and radio waves"
Alcohol,"In chemistry, an alcohol is any organic compound in which the hydroxyl functional group (¨COH) is bound to a saturated carbon atom.[2] The term alcohol originally referred to the primary alcohol ethyl alcohol (ethanol), the predominant alcohol in alcoholic beverages.The suffix -ol appears in the IUPAC chemical name of all substances where the hydroxyl group is the functional group with the highest priority; in substances where a higher priority group is present the prefix hydroxy- will appear in the IUPAC name. The suffix -ol in non-systematic names (such as paracetamol or cholesterol) also typically indicates that the substance includes a hydroxyl functional group and, so, can be termed an alcohol. But many substances, particularly sugars (examples glucose and sucrose) contain hydroxyl functional groups without using the suffix. An important class of alcohols, of which methanol and ethanol are the simplest members is the saturated straight chain alcohols, the general formula for which is CnH2n+1OH."
Polymerase chain reaction,"The polymerase chain reaction (PCR) is a technology in molecular biology used to amplify a single copy or a few copies of a piece of DNA across several orders of magnitude, generating thousands to millions of copies of a particular DNA sequence.Developed in 1983 by Kary Mullis,[1][2] PCR is now a common and often indispensable technique used in medical and biological research labs for a variety of applications.[3][4] These include DNA cloning for sequencing, DNA-based phylogeny, or functional analysis of genes; the diagnosis of hereditary diseases; the identification of genetic fingerprints (used in forensic sciences and DNA paternity testing); and the detection and diagnosis of infectious diseases. In 1993, Mullis was awarded the Nobel Prize in Chemistry along with Michael Smith for his work on PCR The method relies on thermal cycling, consisting of cycles of repeated heating and cooling of the reaction for DNA melting and enzymatic replication of the DNA. Primers (short DNA fragments) containing sequences complementary to the target region along with a DNA polymerase, which the method is named after, are key components to enable selective and repeated amplification. As PCR progresses, the DNA generated is itself used as a template for replication, setting in motion a chain reaction in which the DNA template is exponentially amplified. PCR can be extensively modified to perform a wide array of genetic manipulations."
Fluorine,"Fluorine is a chemical element with symbol F and atomic number 9. It is the lightest halogen and exists as a highly toxic pale yellow diatomic gas at standard conditions. As the most electronegative element, it is extremely reactive: almost all other elements, including some noble gases, form compounds with fluorine.Among the elements, fluorine ranks 24th in universal abundance and 13th in terrestrial abundance. Fluorite, the primary mineral source of fluorine, was first described in 1529; as it was added to metal ores to lower their melting points for smelting, the Latin verb fluo meaning ""flow"" became associated with it. Proposed as an element in 1810, fluorine proved difficult and dangerous to separate from its compounds, and several early experimenters died or sustained injuries from their attempts. Only in 1886 did French chemist Henri Moissan isolate elemental fluorine using low-temperature electrolysis, a process still employed for modern production. Industrial synthesis of fluorine gas for uranium enrichment, its largest application, began during the Manhattan Project in World War II."
Amino acid,"Amino acids (/??mi?no?, ??m?no?, ??ma?no?/) are biologically important organic compounds containing amine (-NH2) and carboxylic acid (-COOH) functional groups, usually along with a side-chain specific to each amino acid.[1][2][3] The key elements of an amino acid are carbon, hydrogen, oxygen, and nitrogen, though other elements are found in the side-chains of certain amino acids. About 500 amino acids are known and can be classified in many ways.[4] They can be classified according to the core structural functional groups' locations as alpha- (ŒÁ-), beta- (ŒÂ-), gamma- (ŒÃ-) or delta- (ŒÄ-) amino acids; other categories relate to polarity, pH level, and side-chain group type (aliphatic, acyclic, aromatic, containing hydroxyl or sulfur, etc.). In the form of proteins, amino acids comprise the second-largest component (water is the largest) of human muscles, cells and other tissues.[5] Outside proteins, amino acids perform critical roles in processes such as neurotransmitter transport and biosynthesis."
Pluto,"is a dwarf planet in the Kuiper belt, a ring of bodies beyond Neptune. It was the first Kuiper belt object to be discovered. It is the largest and second-most-massive known dwarf planet in the Solar System and the ninth-largest and tenth-most-massive known object directly orbiting the Sun. It is the largest known trans-Neptunian object by volume but is less massive than Eris, a dwarf planet in the scattered disc. Like other Kuiper belt objects, Pluto is primarily made of ice and rock[13] and is relatively small¥ªabout one-sixth the mass of Earth's Moon and one-third its volume. It has a moderately eccentric and inclined orbit during which it ranges from 30 to 49 astronomical units or AU (4.4¨C7.4 billion km) from the Sun. This means that Pluto periodically comes closer to the Sun than Neptune, but a stable orbital resonance with Neptune prevents them from colliding. Light from the Sun takes about 5.5 hours to reach Pluto at its average distance (39.5 AU)."
Paramagnetism,"Paramagnetism is a form of magnetism whereby certain materials are attracted by an externally applied magnetic field, and form internal, induced magnetic fields in the direction of the applied magnetic field. In contrast with this behavior, diamagnetic materials are repelled by magnetic fields and form induced magnetic fields in the direction opposite to that of the applied magnetic field.[1] Paramagnetic materials include most chemical elements and some compounds;[2] they have a relative magnetic permeability greater than or equal to 1 (i.e., a positive magnetic susceptibility) and hence are attracted to magnetic fields. The magnetic moment induced by the applied field is linear in the field strength and rather weak. It typically requires a sensitive analytical balance to detect the effect and modern measurements on paramagnetic materials are often conducted with a SQUID magnetometer"
Gibbs free energy,"In thermodynamics, the Gibbs free energy (IUPAC recommended name: Gibbs energy or Gibbs function; also known as free enthalpy[1] to distinguish it from Helmholtz free energy) is a thermodynamic potential that measures the maximum or reversible work that may be performed by a thermodynamic system at a constant temperature and pressure (isothermal, isobaric). Just as in mechanics, where potential energy is defined as capacity to do work, similarly different potentials have different meanings. The Gibbs free energy (kJ/mol in SI units) is the maximum amount of non-expansion work that can be extracted from a thermodynamically closed system (one that can exchange heat and work with its surroundings, but not matter); this maximum can be attained only in a completely reversible process. When a system changes from a well-defined initial state to a well-defined final state, the Gibbs free energy change Œ¤G equals the work exchanged by the system with its surroundings, minus the wo"
Travelling salesman problem,"The travelling salesman problem (TSP) asks the following question: Given a list of cities and the distances between each pair of cities, what is the shortest possible route that visits each city exactly once and returns to the origin city? It is an NP-hard problem in combinatorial optimization, important in operations research and theoretical computer science.In the theory of computational complexity, the decision version of the TSP (where, given a length L, the task is to decide whether the graph has any tour shorter than L) belongs to the class of NP-complete problems. Thus, it is possible that the worst-case running time for any algorithm for the TSP increases superpolynomially (perhaps, specifically, exponentially) with the number of cities.The problem was first formulated in 1930 and is one of the most intensively studied problems in optimization. It is used as a benchmark for many optimization methods. Even though the problem is computationally difficult, a large number of heuristics and exact methods are known, so that some instances with tens of thousands of cities can be solved completely and even problems with millions of cities can be approximated within a small fraction of 1%"
Seafloor spreading,"Seafloor spreading is a process that occurs at mid-ocean ridges, where new oceanic crust is formed through volcanic activity and then gradually moves away from the ridge. Seafloor spreading helps explain continental drift in the theory of plate tectonics. When oceanic plates diverge, tensional stress causes fractures to occur in the lithosphere. Basaltic magma rises up the fractures and cools on the ocean floor to form new sea floor. Older rocks will be found farther away from the spreading zone while younger rocks will be found nearer to the spreading zone."
Thermoelectric effect Seebeck effect,"The thermoelectric effect is the direct conversion of temperature differences to electric voltage and vice versa. A thermoelectric device creates voltage when there is a different temperature on each side. Conversely, when a voltage is applied to it, it creates a temperature difference. At the atomic scale, an applied temperature gradient causes charge carriers in the material to diffuse from the hot side to the cold side.This effect can be used to generate electricity, measure temperature or change the temperature of objects. Because the direction of heating and cooling is determined by the polarity of the applied voltage, thermoelectric devices can be used as temperature controllers.The term ""thermoelectric effect"" encompasses three separately identified effects: the Seebeck effect, Peltier effect, and Thomson effect. Textbooks may refer to it as the Peltier¨CSeebeck effect. This separation derives from the independent discoveries of French physicist Jean Charles Athanase Peltier and Baltic German physicist Thomas Johann Seebeck. Joule heating, the heat that is generated whenever a current is passed through a resistive material, is related, though it is not generally termed as thermoelectric effect. The Peltier¨CSeebeck and Thomson effects are thermodynamically reversible,[1] whereas Joule heating is not."
Moon,"is Earth's only natural satellite. It is one of the largest natural satellites in the Solar System, and, among planetary satellites, the largest relative to the size of the planet it orbits (its primary).[f] It is the second-densest satellite among those whose densities are known (after Jupiter's satellite Io).The Moon is thought to have formed approximately 4.5 billion years ago, not long after Earth. There are several hypotheses for its origin; the most widely accepted explanation is that the Moon formed from the debris left over after a giant impact between Earth and a Mars-sized body called Theia."
Abscisic acid,"also known as abscisin II and dormin, is a plant hormone. ABA functions in many plant developmental processes, including bud dormancy. It is degraded by the enzyme (+)-abscisic acid 8'-hydroxylase into phaseic acid."
Electronegativity,"Electronegativity, symbol ŒÖ, is a chemical property that describes the tendency of an atom or a functional group to attract electrons (or electron density) towards itself.[1] An atom's electronegativity is affected by both its atomic number and the distance at which its valence electrons reside from the charged nucleus. The higher the associated electronegativity number, the more an element or compound attracts electrons towards it. The term ""lectronegativity"" was introduced by J?ns Jacob Berzelius in 1811,[2] though the concept was known even before that and was studied by many chemists including Avogadro.[2] In spite of its long history, an accurate scale of electronegativity had to wait till 1932, when Linus Pauling proposed an electronegativity scale, which depends on bond energies, as a development of valence bond theory.[3] It has been shown to correlate with a number of other chemical properties. Electronegativity cannot be directly measured and must be calculated from other atomic or molecular properties. Several methods of calculation have been proposed, and although there may be small differences in the numerical values of the electronegativity, all methods show the same periodic trends between elements.."
Ozone," is an inorganic molecule with the chemical formula O3. It is a pale blue gas with a distinctively pungent smell. It is an allotrope of oxygen that is much less stable than the diatomic allotrope O2, breaking down in the lower atmosphere to normal dioxygen. Ozone is formed from dioxygen by the action of ultraviolet light and also atmospheric electrical discharges, and is present in low concentrations throughout the Earth's atmosphere (stratosphere). In total, ozone makes up only 0.6 ppm of the atmosphere."
