answer,question
Alzheimers disease,"Alzheimer's disease (AD), also known as Alzheimer disease, or just Alzheimer's, accounts for 60% to 70% of cases of dementia.[1][2] It is a chronic neurodegenerative disease that usually starts slowly and gets worse over time.[1][2] The most common early symptom is difficulty in remembering recent events (short-term memory loss).[1] As the disease advances, symptoms can include problems with language, disorientation (including easily getting lost), mood swings, loss of motivation, not managing self care, and behavioural issues.[1][2] As a person's condition declines, they often withdraw from family and society.[1] Gradually, bodily functions are lost, ultimately leading to death.[3] Although the speed of progression can vary, the average life expectancy following diagnosis is three to nine years.[4][5]"
Tuberculosis,"Tuberculosis, MTB, or TB (short for tubercle bacillus), in the past also called phthisis, phthisis pulmonalis, or consumption, is a widespread, infectious disease caused by various strains of mycobacteria, usually Mycobacterium tuberculosis.[1] Tuberculosis generally affects the lungs, but can also affect other parts of the body. It is spread through the air when people who have an active TB infection cough, sneeze, or otherwise transmit respiratory fluids through the air.[2] Most infections do not have symptoms, known as latent tuberculosis. About one in ten latent infections eventually progresses to active disease which, if left untreated, kills more than 50% of those so infected.[3]The classic symptoms of active TB infection are a chronic cough with blood-tinged sputum, fever, night sweats, and weight loss (the last of these giving rise to the formerly common term for the disease, ""consumption""). Infection of other organs causes a wide range of symptoms. Diagnosis of active TB relies on radiology (commonly chest X-rays), as well as microscopic examination and microbiological culture of body fluids. Diagnosis of latent TB relies on the tuberculin skin test (TST) and/or blood tests. Treatment is difficult and requires administration of multiple antibiotics over a long period of time. Household, workplace and social contacts are also screened and treated if necessary. Antibiotic resistance is a growing problem in multiple drug-resistant tuberculosis (MDR-TB) infections. Prevention relies on early detection and treatment of cases and on screening programs and vaccination with the bacillus Calmette-Gu¨Œrin vaccine."
Mass,"In physics, mass is a property of a physical body which determines the strength of its mutual gravitational attraction to other bodies, its resistance to being accelerated by a force, and in the theory of relativity gives the mass¨Cenergy content of a system. The SI unit of mass is the kilogram (kg)."
Invisible Man,"Invisible Man is a novel by Ralph Ellison, published by Random House in 1952. It addresses many of the social and intellectual issues facing African-Americans early in the twentieth century, including black nationalism, the relationship between black identity and Marxism, and the reformist racial policies of Booker T. Washington, as well as issues of individuality and personal identity.nvisible Man won the U.S. National Book Award for Fiction in 1953.[1] In 1998, the Modern Library ranked Invisible Man nineteenth on its list of the 100 best English-language novels of the 20th century.[2] Time magazine included the novel in its TIME 100 Best English-language Novels from 1923 to 2005."
Tree (data structure),"In computer science, a tree is a widely used abstract data type (ADT)--or data structure implementing this ADT--that simulates a hierarchical tree structure, with a root value and subtrees of children with a parent node, represented as a set of linked nodes.A tree data structure can be defined recursively (locally) as a collection of nodes (starting at a root node), where each node is a data structure consisting of a value, together with a list of references to nodes (the ""children""), with the constraints that no reference is duplicated, and none points to the root Alternatively, a tree can be defined abstractly as a whole (globally) as an ordered tree, with a value assigned to each node. Both these perspectives are useful: while a tree can be analyzed mathematically as a whole, when actually represented as a data structure it is usually represented and worked with separately by node (rather than as a list of nodes and an adjacency list of edges between nodes, as one may represent a digraph, for instance). For example, looking at a tree as a whole, one can talk about ""the parent node"" of a given node, but in general as a data structure a given node only contains the list of its children, but does not contain a reference to its parent (if any)."
Catalysis,"Catalysis (/k??t?l?s?s/) is the increase in the rate of a chemical reaction due to the participation of an additional substance called a catalyst[1] (/?k?t?l?st/). With a catalyst, reactions occur faster and require less activation energy. Because catalysts are not consumed in the catalyzed reaction, they can continue to catalyze the reaction of further quantities of reactant. Often only tiny amounts are required.[2]"
Stark effect,"The Stark effect is the shifting and splitting of spectral lines of atoms and molecules due to presence of an external electric field. The amount of splitting or shifting is called the Stark splitting or Stark shift. In general, one distinguishes first- and second-order Stark effects. The first-order effect is linear in the applied electric field, while the second-order effect is quadratic in the field.The Stark effect is responsible for the pressure broadening (Stark broadening) of spectral lines by charged particles. When the split/shifted lines appear in absorption, the effect is called the inverse Stark effect.The Stark effect is the electric analogue of the Zeeman effect where a spectral line is split into several components due to the presence of a magnetic field.The Stark effect can be explained with fully quantum-mechanical approaches, but it has also been a fertile testing ground for semiclassical methods."
Transpiration,"Transpiration is the process of water movement through a plant and its evaporation from aerial parts, such as leaves, stems and flowers. Water is necessary for plants but only a small amount of water taken up by the roots is used for growth and metabolism. The remaining 99-99.5% is lost by transpiration. Leaf surfaces are dotted with pores called stomata, and in most plants they are more numerous on the undersides of the foliage. The stomata are bordered by guard cells and their stomatal accessory cells (together known as stomatal complex) that open and close the pore.[1] Transpiration occurs through the stomatal apertures, and can be thought of as a necessary ""cost"" associated with the opening of the stomata to allow the diffusion of carbon dioxide gas from the air for photosynthesis. Transpiration also cools plants, changes osmotic pressure of cells, and enables mass flow of mineral nutrients and water from roots to shoots."
Crab Nebula,"The Crab Nebula (catalogue designations M1, NGC 1952, Taurus A) is a supernova remnant and pulsar wind nebula in the constellation of Taurus. It is not, as its name might suggest, in Cancer. The now-current name is due to William Parsons, 3rd Earl of Rosse, who observed the object in 1840 using a 36-inch telescope and produced a drawing that looked somewhat like a crab.[5] Corresponding to a bright supernova recorded by Chinese astronomers in 1054, the nebula was observed later by English astronomer John Bevis in 1731. The nebula was the first astronomical object identified with a historical supernova explosion."
Bose-Einstein condensate,"A Bose¨CEinstein condensate (BEC) is a state of matter of a dilute gas of bosons cooled to temperatures very close to absolute zero (that is, very near 0 K or ?273.15 ¥ãC). Under such conditions, a large fraction of bosons occupy the lowest quantum state, at which point macroscopic quantum phenomena become apparent.This state was first predicted, generally, in 1924¨C25 by Satyendra Nath Bose and Albert Einstein."
Citric acid cycle,"The citric acid cycle ¨C also known as the tricarboxylic acid (TCA) cycle or the Krebs cycle[1][2] ¨C is a series of chemical reactions used by all aerobic organisms to generate energy through the oxidation of acetyl-CoA derived from carbohydrates, fats and pro"
Precession,"Precession is a change in the orientation of the rotational axis of a rotating body. In an appropriate reference frame it can be defined as a change in the first Euler angle, whereas the third Euler angle defines the rotation itself. In other words, the axis of rotation of a precessing body itself rotates around another axis. A motion in which the second Euler angle changes is called nutation. In physics, there are two types of precession: torque-free and torque-induced.In astronomy, ""precession"" refers to any of several slow changes in an astronomical body's rotational or orbital parameters, and especially to Earth's precession of the equinoxes. (See section Astronomy below.)"
Phloem,"In vascular plants, phloem is the living tissue that carries organic nutrients (known as photosynthate), in particular, sucrose,[1] a sugar, to all parts of the plant where needed. In trees, the phloem is the innermost layer of the bark, hence the name, derived from the Greek word ŒÕŒËŒÏŒÉ?? (phloios) meaning """". The phloem is concerned mainly with the transport of soluble organic material made during photosynthesis. This process of transportation is called translocation.[2]ttro"
Four color theorem,"In mathematics, the four color theorem, or the four color map theorem, states that, given any separation of a plane into contiguous regions, producing a figure called a map, no more than four colors are required to color the regions of the map so that no two adjacent regions have the same color. Two regions are called adjacent if they share a common boundary that is not a corner, where corners are the points shared by three or more regions.[1] For example, in the map of the United States of America, Utah and Arizona are adjacent, but Utah and New Mexico, which only share a point that also belongs to Arizona and Colorado, are not.Despite the motivation from coloring political maps of countries, the theorem is not of particular interest to mapmakers. According to an article by the math historian Kenneth May (Wilson 2014, 2), Maps utilizing only four colors are rare, and those that do usually require only three. Books on cartography and the history of mapmaking do not mention the four-color property.Three colors are adequate for simpler maps, but an additional fourth color is required for some maps, such as a map in which one region is surrounded by an odd number of other regions that touch each other in a cycle. The five color theorem, which has a short elementary proof, states that five colors suffice to color a map and was proven in the late 19th century (Heawood 1890); however, proving that four colors suffice turned out to be significantly harder. A number of false proofs and false counterexamples have appeared since the first statement of the four color theorem in 1852.The four color theorem was proven in 1976 by Kenneth Appel and Wolfgang Haken. It was the first major theorem to be proved using a computer. Appel and Haken's approach started by showing that there is a particular set of 1,936 maps, each of which cannot be part of a smallest-sized counterexample to the four color theorem. (If they did appear, you could make a smaller counter-example.) Appel and Haken used a special-purpose computer program to confirm that each of these maps had this property. Additionally, any map that could potentially be a counterexample must have a portion that looks like one of these 1,936 maps. Showing this required hundreds of pages of hand analysis. Appel and Haken concluded that no smallest counterexamples exist because any must contain, yet do not contain, one of these 1,936 maps. This contradiction means there are no counterexamples at all and that the theorem is therefore true. Initially, their proof was not accepted by all mathematicians b"
Lysosome,"A lysosome (derived from the Greek words lysis, meaning ""to loosen"", and soma, ""body"") is a membrane-bound cell organelle found in most animal cells (they are absent in red blood cells). Structurally and chemically, they are spherical vesicles containing hydrolytic enzymes capable of breaking down virtually all kinds of biomolecules, including proteins, nucleic acids, carbohydrates, lipids, and cellular debris. They are known to contain more than 50 different enzymes, which are all optimally active at an acidic environment of about pH 4.5 (about the pH of black coffee). Thus lysosomes act as the waste disposal system of the cell by digesting unwanted materials in the cytoplasm, both from outside of the cell and obsolete components inside the cell. For this function they are popularly referred to as ""suicide bags"" or ""suicide sacs"" of the cell.[1][2] Furthermore, lysosomes are responsible for cellular homeostasis for their involvements in secretion, plasma membrane repair, cell signalling and energy metabolism, which are related to health and diseases.[3] Depending on their functional activity, their sizes can be very different¥ªthe biggest ones can be more than 10 times bigger than the smallest ones.[4] They were discovered and named by Belgian biologist Christian de Duve, who eventually received the Nobel Prize in Physiology or Medicine in 1974. Enzymes of the lysosomes are synthesised in the rough endoplasmic reticulum. The enzymes are released from Golgi apparatus in small vesicles which ultimately fuse with acidic vesicles called endosomes, thus becoming full lysosomes. In this process, the enzymes are specifically tagged with the molecule mannose 6-phosphate to differentiate them from other enzymes. Lysosomes are interlinked with three intracellular processes, namely phagocytosis, endocytosis and autophagy. Extracellular materials such as microorganisms taken up by phagocytosis, macromolecules by endocytosis, and unwanted cell organelles are fused with "
Steel,"Steels are alloys of iron and other elements, primarily carbon, widely used in construction and other applications because of their high tensile strengths and low costs. Carbon, other elements, and inclusions within iron act as hardening agents that prevent the movement of dislocations that otherwise occur in the crystal lattices of iron atoms.The carbon in typical steel alloys may contribute up to 2.1% of its weight. Varying the amount of alloying elements, their formation in the steel either as solute elements, or as precipitated phases, retards the movement of those dislocations that make iron comparatively ductile and weak, and thus controls qualities such as the hardness, ductility, and tensile strength of the resulting steel. Steel's strength compared to pure iron is only possible at the expense of ductility, of which iron has an excess.Although steel had been produced in bloomery furnaces for thousands of years, steel's use expanded extensively after more efficient production methods were devised in the 17th century for blister steel and then crucible steel. With the invention of the Bessemer process in the mid-19th century, a new era of mass-produced steel began. This was followed by Siemens-Martin process and then Gilchrist-Thomas process that refined the quality of steel. With their introductions, mild steel replaced wrought iron.Further refinements in the process, such as basic oxygen steelmaking (BOS), largely replaced earlier methods by further lowering the cost of production and increasing the quality of the metal. Today, steel is one of the most common materials in the world, with more than 1.3 billion tons produced annually. It is a major component in buildings, infrastructure, tools, ships, automobiles, machines, appliances, and weapons. Modern steel is generally identified by various grades defined by assorted standards organizations."
Meissner effect,"The Meissner effect is the expulsion of a magnetic field from a superconductor during its transition to the superconducting state. The German physicists Walther Meissner and Robert Ochsenfeld discovered this phenomenon in 1933 by measuring the magnetic field distribution outside superconducting tin and lead samples.[1] The samples, in the presence of an applied magnetic field, were cooled below their superconducting transition temperature. Below the transition temperature the samples cancelled nearly all interior magnetic fields. They detected this effect only indirectly because the magnetic flux is conserved by a superconductor: when the interior field decreases, the exterior field increases. The experiment demonstrated for the first time that superconductors were more than just perfect conductors and provided a uniquely defining property of the superconducting state.A superconductor with little or no magnetic field within it is said to be in the Meissner state. The Meissner state breaks down when the applied magnetic field is too large. Superconductors can be divided into two classes according to how this breakdown occurs. In Type I superconductors, superconductivity is abruptly destroyed when the strength of the applied field rises above a critical value Hc. Depending on the geometry of the sample, one may obtain an intermediate state[2] consisting of a baroque pattern[3] of regions of normal material carrying a magnetic field mixed with regions of superconducting material containing no field. In Type II superconductors, raising the applied field past a critical value Hc1 leads to a mixed state (also known as the vortex state) in which an increasing amount of magnetic flux penetrates the material, but there remains no resistance to the flow of electric current as long as the current is not too large. At a second critical field strength Hc2, superconductivity is destroyed. The mixed state is actually caused by vortices in the electronic superfluid, sometimes called fluxons because the flux carried by these vortices is quantized. Most pure elemental superconductors, except niobium and carbon nanotubes, are Type I, while almost all impure and compound superconductors are Type II."
Ammonia,"Ammonia or azane is a compound of nitrogen and hydrogen with the formula NH3. It is a colourless gas with a characteristic pungent smell. Ammonia contributes significantly to the nutritional needs of terrestrial organisms by serving as a precursor to food and fertilizers. Ammonia, either directly or indirectly, is also a building block for the synthesis of many pharmaceuticals and is used in many commercial cleaning products. Although common in nature and in wide use, ammonia is both caustic and hazardous in its concentrated form."
Bessel function,"Bessel functions, first defined by the mathematician Daniel Bernoulli and then generalized by Friedrich Bessel, are the canonical solutions y(x) of Bessel's differential equationfor an arbitrary complex number ŒÁ (the order of the Bessel function). Although ŒÁ and ?ŒÁ produce the same differential equation for real ŒÁ, it is conventional to define different Bessel functions for these two values in such a way that the Bessel functions are mostly smooth functions of ŒÁ.The most important cases are for ŒÁ an integer or half-integer. Bessel functions for integer ŒÁ are also known as cylinder functions or the cylindrical harmonics because they appear in the solution to Laplace's equation in cylindrical coordinates. Spherical Bessel functions with half-integer ŒÁ are obtained when the Helmholtz equation is solved in spherical coordinates."
Turbulence,"In fluid dynamics, turbulence or turbulent flow is a flow regime characterized by chaotic property changes. This includes low momentum diffusion, high momentum convection, and rapid variation of pressure and flow velocity in space and time.Flow in which the kinetic energy dies out due to the action of fluid molecular viscosity is called laminar flow. While there is no theorem relating the non-dimensional Reynolds number (Re) to turbulence, flows at Reynolds numbers larger than 5000 are typically (but not necessarily) turbulent, while those at low Reynolds numbers usually remain laminar. In Poiseuille flow, for example, turbulence can first be sustained if the Reynolds number is larger than a critical value of about 2040;[1] moreover, the turbulence is generally interspersed with laminar flow until a larger Reynolds number of about 4000.In turbulent flow, unsteady vortices appear on many scales and interact with each other. Drag due to boundary layer skin friction increases. The structure and location of boundary layer separation often changes, sometimes resulting in a reduction of overall drag. Although laminar-turbulent transition is not governed by Reynolds number,[why?] the same transition occurs if the size of the object is gradually increased, or the viscosity of the fluid is decreased, or if the density of the fluid is increased. Nobel Laureate Richard Feynman described turbulence as ""the most important unsolved problem of classical physics.""[2]"
Xylem,"Xylem is one of the two types of transport tissue in vascular plants, phloem being the other. The word xylem is derived from the Greek word ŒÎ?ŒËŒÏŒÍ (xylon), meaning """"; the best-known xylem tissue is wood, though it is found throughout the plant. The basic function of xylem is to transport water, but it also transports some nutrients..lam"
Genomic imprinting,"Genomic imprinting is the epigenetic phenomenon by which certain genes are expressed in a parent-of-origin-specific manner. If the allele inherited from the father is imprinted, it is thereby silenced, and only the allele from the mother is expressed. If the allele from the mother is imprinted, then only the allele from the father is expressed. Forms of genomic imprinting have been demonstrated in fungi, plants and animals.[1] Genomic imprinting is a fairly rare phenomenon in mammals; most genes are not imprinted.[citation needed]In insects, imprinting affects entire chromosomes. In some insects the entire paternal genome is silenced in male offspring, and thus is involved in sex determination. The imprinting produces effects similar to the mechanisms in other insects that eliminate paternally inherited chromosomes in male offspring, including arrhenotoky.[2]Genomic imprinting is an inheritance process independent of the classical Mendelian inheritance. It is an epigenetic process that involves DNA methylation and histone methylation without altering the genetic sequence. These epigenetic marks are established (""imprinted"") in the germline (sperm or egg cells) of the parents and are maintained through mitotic cell divisions in the somatic cells of an organism.[3]Appropriate imprinting of certain genes is important for normal development. Human diseases involving genomic imprinting include Angelman syndrome and Prader¨CWilli syndrome."
Vulcanization,"Vulcanization or vulcanisation is a chemical process for converting natural rubber or related polymers into more durable materials via the addition of sulfur[1] or other equivalent curatives or accelerators. These additives modify the polymer by forming cross-links (bridges) between individual polymer chains.[2][3] Vulcanized materials are less sticky and have superior mechanical properties. The term vulcanized fibre refers to cellulose that has been treated in a zinc chloride solution to cross-link the cellulose fibers.Although the curing of rubber has been carried out since prehistoric times, the modern process of vulcanization, named after Vulcan, the Roman god of fire, was not developed until the 19th century, mainly by Charles Goodyear. Today, a vast array of products are made with vulcanized rubber including tires, shoe soles, hoses, and conveyor belts. Hard vulcanized rubber is sometimes sold under the brand names ebonite or vulcanite, and is used in making articles such as clarinet and saxophone mouth pieces, bowling balls and hockey pucks."
Claude Levi-Strauss," 28 November 1908 ¨C 30 October 2009)[2][3][4] was a French anthropologist and ethnologist whose work was key in the development of the theory of structuralism and structural anthropology.[5] He held the chair of Social Anthropology at the Coll¨¨ge de France between 1959 and 1982 and was elected a member of the Acad¨Œmie fran?aise in 1973. He received numerous honors from universities and institutions throughout the world and has been called, alongside James George Frazer and Franz Boas,[6] the ""her of modern anthropology"". L¨Œvi-Strauss argued that the ""avage"" mind had the same structures as the ""civilized"" mind and that human characteristics are the same everywhere.[8][9] These observations culminated in his famous book Tristes Tropiques that established his position as one of the central figures in the structuralist school of thought. As well as sociology, his ideas reached into many fields in the humanities, including philosophy. Structuralism has been defined as ""the search for the underlying patterns of thought in all forms of human activity..g t"
